Nom;Brasserie;Pays;Note;Type;Fermentation;°Alc;Bouteille;Ville;Appréciation;Observations;Nom;;
Coreff étiquette noire;Des 2 rivières;France;15,5;Brown Ale;haute;5;50 cl;Morlaix;Marron foncée, limpide, bien  saturée , mousse serrée et durable formant un chapeau beige. Nez doux, fin, nuancé, très aromatique de  levure  et  houblon . Plénitude en bouche, corps bien formé, nuances de  malt  torréfié, amertume bien dosée et persistante. Tons fruités-alcoolisés. Très bonne bière.;Refermentée en bouteille. De type  Ale , fruitée, amère et aromatique.;Coreff étiquette noire;;
Corona;;Allemagne;12,5;Spéciale basse;basse;4,4;33 cl;;Bière spéciale de fermentation basse de type München, couleur marron, assez limpide, finement saturée, mousse beige claire serrée, de belle tenue. Nez de  caramel  et de  malt  mêlés, peu houblonné. Saveur ronde fortement maltée. Corps doux et tenace ; rondeur dominante, peu amère. Correcte.;;Corona;;
Corona Extra;Modelo;Mexique;12;Pils;basse;4,6;33 cl;Mexico;Pils  claire et limpide, bien saturée en bulles fines, mousse blanche peu serrée de tenue moyenne. Arôme fin et léger (maïs ?), agréable et frais. Saveur fine, peu maltée, évoquant des tons de maïs. Bière typique, très fine et subtile. Peu corsée, idéale par grande chaleur, a boire glacée.;;Corona Extra;;
Corsendonk Agnus;Corsendonk;Belgique;15;Abbaye;haute;8;33 cl;Oud Turnhout;Abbaye  blonde dorée, limpide (sur  levure ), mousse blanche abondante et serrée. Arôme riche et complexe, nez de  houblon  aromatique et de  malt  rond mais restant assez frais. Saveur corsée de houblons aromatiques et de levures, légère acreté agréable saveur d'épices douces. Bonne bière typée;Bière d'abbaye belge.;Corsendonk Agnus;;
Corsendonk Pater;Corsendonk;Belgique;15;Abbaye;haute;8;33 cl;Oud Turnhout;Abbaye  acajou, limpide (sur levure), mousse beige abondante à l'aspect crémeux, de stabilité moyenne. Odeur riche et puissante, fruité profond de  malt ,  levure  et alcool. Saveur typée, douce et relevée. Tons caramélisés agréables, goût corsé d'épices douces, légère acreté et amertume moyenne.;;Corsendonk Pater;;
Cripple Dick;St Austell;Angleterre;13,5;Barley Wine;haute;11,7;275 ml;Cornwall;Couleur rousse-acajou, limpide, mousse claire assez serrée de courte tenue. Nez riche, onctueux, sucré, aux tons de fruits très murs (prune, banane). Saveur sucrée, corps marqué sans être trop lourd, bouche liquoreuse assez concentrée, légèrement piquante et caramélisée. Bonne bière très forte.;Strong  Ale  anglaise, forte, chaleureuse, réconfortante et  capiteuse .;Cripple Dick;;
Cristal alken;;Belgique;12;Pils;Basse;4,8;25 cl;Alken;;;Cristal alken;;
Cuvée château des flandres;Van steenbergen;Belgique;13,5;Spéciale;haute;8;25 cl;Ertevelde;Spéciale de couleur acajou, limpide, mousse abondante et serrée de durée moyenne. Arôme assez doux de  malt  légèrement caramélisé. Refermentée en bouteille, son goût évolue vers le moelleux caramélisé, avec un corps satisfaisant sans excès. Bonne bière douce à servir à 10 degrès.;Brassée d'après une recette de 'De hopduvel' (le diable du  houblon ) à Gand;Cuvée château des flandres;;
Cuvée de CINEY brune;Demarche;Belgique;13;Spéciale;haute;7;25 cl;Ciney;Une brune respectable mais non extraordinaire.;;Cuvée de CINEY brune;;
Cuvée de CINEY spéciale;Demarche;Belgique;13,5;Spéciale;haute;6,2;25 cl;Ciney;Une ambrée de qualité, sans personnalité excessive;;Cuvée de CINEY spéciale;;
Cuvée de l'Ermitage;Alken-Maes;Belgique;13;Spéciale;Haute;8,5;25 cl;Kontich-Waarloos;;;Cuvée Ermitage;;
Cuvée de l'ermitage Christmas;Alken-Maes;Belgique;15;Abbaye;haute;8;25 cl;Waarloos;Brune-acajou, limpide, moyennement  saturée  en bulles fines, mousse serrée de durée moyenne. Arôme moelleux, très malté et caramélisé aux nuances fruitées-liquoreuses. Première bouche velouteuse, goût doux, rond et très malté. Amertume fine et arrière-goût assez sec. Bonne bière d' abbaye  douce.;Bière de Noël de la  Cuvée de l'ermitage .;Cuvée de l'ermitage Christmas;;
Cuvée de Namur blonde;Le Namurois;Belgique;15;Spéciale;haute;6,7;25 cl;Namur;Jaune dorée, limpide et peu  saturée , mousse blanche, serrée, assez tenace. Nez de  houblon  agréable, odeur aromatique, douceur acidulée de céréales affirmée et fruitée. Goût ample, plein et fruité, bouche amère mais douce à la post-amertume équilibrée. Saveur de céréales et d'aromates agréable.;Bière blonde spéciale.;Cuvée de Namur blonde;;
Cuvée de Namur brune;Le Namurois;Belgique;13,5;Spéciale;haute;6,7;25 cl;Namur;Brune acajou, limpide, peu  saturée , mousse brune aérée peu tenace. Arôme profond et bien malté, nez doux et caramélisé. Saveur de  malt   caramel  douce, mais peu fruitée, ni épicée, ni âcre, faite de rondeur et douceur. Bière agréable, douce et peu amère, bien en bouche mais peu relevée.;Bière brune  spéciale .;Cuvée de Namur brune;;
Cuvée des jonquilles;Bailleux;France;13,5;Garde;haute;7;75 cl;Gussignies;Bière de  garde  blonde, sur lie, non pasteurisée. Troublée par la  levure , cette bière dorée-pâle posséde une mousse assez aérée mais abondante, de tenue moyenne. Arôme acre des levures, légèrement pilsé. Goût assez acre et corsé, bonne amertume. Bière de garde très correcte.;Sur lie, non pasteurisée.;Cuvée des jonquilles;;
Cuvée du Spartacus;De coster;Belgique;13;Spéciale;haute;6,2;25 cl;Gouy;Bière marron, limpide (sur levure), bien saturée, mousse beige onctueuse et abondante sur paquets de  levure . Arôme de  malt  caramel intense et doux. Saveur légèrement acre, goût  caramel  dominant sans excès, bouche sèche et équilibrée, bonne rondeur maltée peu amère, au corps moyen. Correcte.;;Cuvée du Spartacus;;
Cuvée St Amand;Bavik;Belgique;14;Spéciale;haute;7,5;25 cl;Bavikhove;Spéciale  de couleur rousse, cristalline, finement saturée, mousse onctueuse et stable. Au nez ; bois,  caramel  et  levure . Saveur assez sèche et amère rappelant certaines 'Pales Ales', palais agréable et corsé sans excès, à dominante  malt - caramel -houblon . Bonne bière de type ' Ale ' anglaise.;;Cuvée St Amand;;
Dab Dortmunder;;;;;;;;;;;Dab Dortmunder;;
De koninck;De koninck;Belgique;14,5;Spéciale;haute;8;33 cl;Anvers;Une bière ambrée, au goût très malté, bonne odeur de  houblon . Assez plate. Probablement proche d'une  Ale , assez fruitée, subtil goût de  futaille , bonne bière dans l'ensemble.;Bière de fermentation haute, brasserie de Koninck.;De koninck;;
De Neve gueuze lambic;De neve;Belgique;14,5;Lambic;spontanée;5,2;25 cl;Schepdaal;Gueuze orangée, cristalline, bien saturée, à la mousse blanche serrée de tenue correcte. Arôme vieux  houblon , nez intense évoquant des fruits mûrs Saveur douce, peu amére, surette, fruitée, subtilement  astringente . Belle attaque et subsistance d'un arrière goût de fruits mûrs et sucrés.; Gueuze   lambic  filtrée et sucrée.  De Neve  existe depuis 1772.;De Neve gueuze lambic;;
De Neve kriek lambic;De neve;Belgique;12,5;Lambic;spontanée;5,2;25 cl;Schepdaal;Kriek  rouge foncée, limpide, bien  saturée , mousse rosée assez stable. Nez d'extrait de cerises aux allures artificiellement douces, peu sur. Léger nez de vieux  houblon . Au goût,  lambic  assez sur, doux et fruité, Saveur de sirop de cerises agréable sans être extraordinaire.;Gueuze aux cerises, filtrée et sucrée.  De Neve  existe depuis 1772.;De Neve kriek lambic;;
De troch tropical;De troch;Belgique;14;Lambic;spontanée;3;25 cl;Belgique;Un  lambic  banane de bonne qualité, avec un petit goût d'artificiel (surtout en fin de bouche). Contient du fructose. Correct et dépaysant.;Produit à base de vrai  lambic  mûri en foudres de chêne.;De troch tropical;;
Delirium Tremens;Huyghe;Belgique;14,5;Spéciale;haute;9;33 cl;Gand;Abricot-trouble, bien  saturée , mousse blanche fine subsistant sur 3 mm. Nez puissant, doux, révélant une certaine acreté et un maltage profond. Bouche pleine et douce, amertume et acreté prononcées et durables. Saveur puissante, post-saveur durable. Corsée, forte et  capiteuse .;Saveur puissamment douce et acre. Triple fermentation.;Delirium Tremens;;
Dentergems;Riva;Belgique;12;Blanche;haute;5;25 cl;Dentergem;Bière pâle, légèrement voilée. Mousse abondante, bon arôme citronné L'acidité assez forte disparaît plutôt vite, le bouquet est fruité lors de l'entrée en bouche, légèrement sucré, mais manque de plénitude et de corps, l'arrière goût est plutôt fugace. Correcte, sans plus;Bière  blanche  de froment et d'orge;Dentergems;;
Desperados;Fischer;France;12;Spéciale;Basse;5,9;33 cl;Schiltigheim;Bière à l'arôme de tequila.;;;;
Deugniet;Du Bocq;Belgique;14;Spéciale;haute;8;25 ou 75 cl;Purnode;Dorée, sur levure, mousse blanche très fine et tenace, moyennement saturée. Très bon nez de  houblon  amer, acre ( levure ), profond et corsé. Saveur bien maltée, équilibrée et nuancée entre l'amertume, la rondeur aromatique de levure et une mâche moelleuse. Bonne bière mi-douce et amère.;Bière blonde sur lie, corsée et aromatique.;Deugniet;;
Diekirch grande réserve;Diekirch;Luxembourg;13;Spéciale basse;basse;6,9;25 cl;Diekirch;Une bière dorée, presque ambrée, mousse serrée de  pils , arôme de  malt  caramélisé très subtil. Assez bonne bière, légères nuances de  caramel , mais sans excès. Bien maltée, moyennement amère. Bonne bière apéritive.;;Diekirch grande réserve;;
Diekirch premium pils;Diekirch;Luxembourg;13;Pils;basse;4,8;33 cl;Diekirch;Pils  jaune, cristalline, peu  saturée  en bulles fines. Mousse serrée et tenace. Arôme malté, nez agréable de  houblon . Saveur nette et maltée (bière pur  malt ), bien en bouche, légères amertume et post-amertume.  pils  très agréable, classique, bien faite et désaltérante tout en ayant du goût.;La brasserie Diekirch existe depuis 1871.;Diekirch premium pils;;
Diekirch réserve 1871;Diekirch;Luxembourg;13;Pils;basse;5,2;33 cl;Diekirch;Pils dorée, cristalline, peu  saturée , bulle fines, mousse serrée de tenue moyenne-faible. Arôme bien malté, bon nez, profond, riche et onctueux. Bière assez ronde, coule bien en bouche, légère amertume, post-amertume se prolongeant. Saveur toutefois moins riche que l'arôme.  pils  agréable.;Fournisseur de la cour Luxembourgeoise.;Diekirch réserve 1871;;
Dikke Mathile;Strubbe;Belgique;14,5;Spéciale;haute;6;25 cl;Ichtegem;Une spéciale  belge orange abricot, à mousse moyennement serrée, de tenue moyenne, subistant en crème sur 3 à 4 mm. Bière transparente, sauf si on lui ajoute un peu de sa  levure . Arôme acre de levure (petits paquets). Bière ronde, de corps et d'amertume moyenne. Bonne bière agréable.;;Dikke Mathile;;
Dikkenek;Dikkenek;Belgique;11;Spéciale;haute;5,5;25 cl;Hasselt;Une  spéciale  marron-acajou, limpide, à la mousse beige serrée assez stable. Odeur de  malt  aux tons de caramel, nez fin mais peu affirmé. Saveur nette de  caramel , douce et peu amère, restant en début de bouche. Peu de mâche, corps moyen, bouche un peu pâteuse. Bière perfectible, non extraordinaire;;Dikkenek;;
Dobbelen Bruinen;;;;;;;;;;;Dobbelen Bruinen;;
Dock Street;Dock Street Brewing Co.;U.S.A;13,5;Pale Ale;haute;5,2;35.5 cl;Philadelphie;Une bière ambrée-rousse limpide, à mousse serrée et légèrement crémeuse. Arôme profond de  malt  (subtile odeur de  caramel ) et de  houblon , assez ordinaire toutefois. Goût très présent du malt, bière assez sèche à l'amertume moyenne. Bon équilibre général pour cette bière très correcte.;Amber beer (Probable équivalent américain de la  Pale Ale );Dock Street;;
Donkle béer;Mousel;Luxembourg;13;Spéciale basse;basse;7;25 cl;Luxembourg;Bière brune foncée, mousse marron clair, crémeuse de tenue correcte. Arôme puissant, sans être trop doux, de  caramel  et de  malt  torréfié, qui évoque vaguement l'arôme  Guinness . Goût assez sec, amer-caramélisé, saveur grillée Coule bien mais corps moyen, légère post-amertume. Bonne bière agréable.;Bière sortie en 1986.;Donkle béer;;
Dos Equis;;Mexique;13;Pils;Basse;5,4;33 cl;;;;Dos Equis;;
Double blonde;Gigi;Belgique;9;Pils;basse;1,17;33 cl;Gerouville;Une pauvre en alcool dorée, mousse aérée d'assez courte tenue, saturation moyenne. Arôme léger de  houblon , et présence affirmée d'un  malt  sucré. Au goût ; manque évident d'alcool, bière bien maltée mais vraiment sucrée, amertume moyenne. Sorte de limonade au  malt  houblonnée.;Fabrication artisanale depuis 1888. Bière pauvre en alcool.;Double blonde;;
Double Enghien;De Silly Brouwerj;Belgique;13;Spéciale;Haute;7,5;25 cl;Silly;;;;;
Douglas scotch Ale;;Angleterre;12;Scotch Ale;haute;8,6;33 cl;Grande bretagne;Une  Ale  très forte et presque sirupeuse, à consommer comme réconfortant ! Arôme profond, mais saveur fortement caramélisée et assez sucrée, bière riche et lourde, que nous n'apprécions que moyennement.;;Douglas scotch Ale;;
Drie Fonteinen Framboise Lambic;Drie fonteinen;Belgique;16;Lambic;spontanée;5;75 cl;Beersel;Framboise lambic rose-orangée, sur lie, mousse peu tenace, saturation moyenne. Nez d'abord acide, avec une douceur fruitée d' arrière plan. Arômes boisé et de branchages verts. Saveur acide dominante, goût brut, framboise atténuée, assez peu présente. Excellent lambic réellement authentique.;Lambic du Drie Fonteinen à boire avec un sucre écrasé au fond du verre.;Drie Fonteinen Framboise Lambic;;
Drie Fonteinen Gueuze Lambic;Drie Fonteinen;Belgique;16;Lambic;spontanée;4,5;75 cl;Beersel;Gueuze  lambic  dorée, transparente (sur lie), bien saturée. Mousse claire tenace. Au nez, parfums boisés, verts et sûrs, mais ronds. Goût velouté et acide caractéristique, amertume légère et courte. Bouche fruitée (pomme verte, tons de kiwi et arrière goût doux de poire Williams.). Un must !;Véritable  gueuze  lambic de la région de Bruxelles.;Drie Fonteinen Gueuze Lambic;;
Duchesse de Bourgogne;Verhaege;Belgique;13;Spéciale;haute;6,2;25 cl;Vichte;Bière rouge acajou, limpide, finement saturée, mousse brune stable formant un chapeau. Nez typique des Oud Bruin, boisé, aigre et vert. Saveur sucrée en première bouche, puis aigrelette, mais la douceur subsiste et réduit le côté rafraîchissant typique de ce genre de bière. Dommage, perfectible.;Bière de type ' Oud Bruin '.;Duchesse de Bourgogne;;
Duivel's bier;Vanderlinden;Belgique;15;Spéciale;haute;6;25 cl;Halle;D'une chaude couleur boisée, limpide, moyennement  saturée , mousse abondante et assez tenace. Nez particulier, doux-sur (fruit confit). Heureux mariage équilibré et inhabituel de saveur caramélisées et acides. Arrière-goût aigrelet durable et agréable. Bonne bière à la saveur peu courante.;Mélange de haute et de spontanée ( lambic );Duivel's bier;;
Dulle Teve;De dolle Brouwers;Belgique;13;Pils;Basse;10;25 cl;Esen;;;;;
Duvel rouge;Moortgat;Belgique;18;Spéciale;haute;8,5;33 cl;Breendonk;Blonde, mousse abondante et assez serrée, de longue tenue, belle accroche. Limpide (sur  levure ). Goût puissant, délicat et corsé. Belle amertume, post amertume marquée, de durée moyenne. Arôme de  houblon  frais, bouche longue délicate; complexe et puissante. Nez riche, de  levure  fruitée. Superbe !;Sans produits chimiques, nécessite son verre spécial pour être bue.;Duvel rouge;;
Duvel verte;Moortgat;Belgique;14,5;Spéciale;haute;7,5;25 cl;Breendonk;Une bonne bière blonde, corsée, savoureuse. Néanmoins, la Duvel verte ne vaut pas la Rouge du même nom , elle est filtrée (il n'y a plus de levures en bouteille, la bière est cristalline, elle n'évolue plus en bouteille). Manque du fruité et de l'acreté de la Duvel rouge.;Bière blonde de fermentation haute, filtrée;Duvel verte;;
Eau Bénite;Unibroue;Canada;11;Spéciale;Haute;7,7;33 cl;Chambly;;;;;
Echte kriek;Verhaege;Belgique;11;Spéciale;haute;6,2;25 cl;Belgique;Une  spéciale  belge, parfumée à la cerise. Bière un peu caramélisée, mixture bizarre, mélangeant grossièrement  caramel  et cerises. Manque d'équilibre, manque d'âme,  kriekenbier  très moyenne.;Brasserie Verhaege;Echte kriek;;
Edelpils;Battin;Luxembourg;13,5;Pils;basse;4,8;33 cl;Esch sur Alzette;Une  pils  claire et limpide, jolie mousse blanche, serrée et de durée moyenne. Bière bien houblonnée (l'amertume persiste en bouche) et légère. Arôme de  malt  et de  houblon  bien présent, bonne  pils  agréable.;Bière spécialement houblonnée (dixit étiquette).;Edelpils;;
Edinburg Strong Ale;The Caledonian;Angleterre;13;Ale;haute;6,4;500 ml;Edinburg;Bière orangée, mousse très fine;;Edinburg Strong Ale;;
Eggenberg Svetle 12%;Eggenberg;République Tchéque;13;Pils;basse;3,1;50 cl;Cesky Krumlov;Dorée, limpide, très saturée, mousse blanche et serrée. Arôme de  malt  net et franc, nez évoquant les houblons amérisants tchéques, subtils tons fumés Bouche aux contours nets, amertume bien présente, post-amertume longue. Corps dense, bouche pleine et douce.  Pils  corsée, à déguster fraîche.;Bière brassée à Cesky Krumlov (République Tchéque);Eggenberg Svetle 12%;;
Eggenberg Tmavé 10%;Eggenberg;République Tchéque;13;Spéciale basse;basse;3;50 cl;Cesky Krumlov;Marron claire, limpide, mousse beige claire serrée et tenace, saturation moyenne. Arôme fin de  malt  caramel, houblonnage léger et fruité. Saveur assez sèche, bouche au léger goût de  caramel  et de  houblon , amertume nette, post-amertume tenace. Arrière oût caramel brûlé amer. Correcte, sans plus.;Bière brassée en République Tchéque, à Cesky Krumlov.;Eggenberg Tmavé 10%;;
Eggenberger Urbock;Eggenberg;Autriche;14;Bock;basse;9,6;33 cl;Vorchdorf;Bière blonde-dorée, voire ambrée, cristalline. Arôme très profond de  malt  bien houblonné, arôme très doux et puissant, belle mousse onctueuse. Saveur pleine et amère, post-amertume et légère âpreté, bière sucrée très moelleuse et  capiteuse . Bonne bière, très riche, forte et sucrée.;Bière  bock  autrichienne.;Eggenberger Urbock;;
Egmont;Crombe;Belgique;14;Spéciale;haute;7;33 cl;Zottegem;Spéciale de couleur jaune, voilée, mousse blanche serrée et abondante. Nez affirmé mais assez frais de  houblon  et  levure . Saveur corsée et amère ample, ronde et aromatique. Bonne bouche agréable, coule harmonieusement. Corsée, amère, goût de  levure marqué, saveur peu épicée. Bière agréable.;Bière au goût évolutif.;Egmont;;
Eichbaum Leichter Typ;Eichbaum;Allemagne;11,5;Pils;basse;2;33 cl;Mannheim;Pils  pâle, limpide, peu saturée, belle mousse blanche serrée. Arôme frais de  malt , nez herbacé agréable. Bouche correcte, maltée sans excès, assez amère. Bouche de céréales manquant de relief alcoolisé et de fruité. Quand même assez agréable pour une 'légère en alcool';;Eichbaum Leichter Typ;;
EKU 28;Erste Kulmbacher;Allemagne;15;Doppelbock;basse;11;33 cl;Kulmbach;Bière orangée, limpide, finement saturée. Mousse beige très fugace. Arôme puissant et liquoreux, nez sucré intensément malté. Saveur sucrée, goût de  caramel . Bouche très moelleuse, ample, ronde et liquoreuse voire sirupeuse. Amertume très faible, tons fumés discrets. Bière tout à fait extraordinaire;Une des bières les plus fortes du monde !;EKU 28;;
Elckerlijc;Callewaert;Belgique;14,5;Spéciale;haute;5,5;25 cl;Zwevezele;Rousse-rouge, limpide,  saturation  normale, chapeau de mousse fine et stable Nez de classe, aigre-doux, fin mais franc, tons vineux aux subtilités de  caramel . Légère astrigence, bonne bouche boisée aigrelette et fruitée, peu acre. Arrière goût amer de vieux  houblon , équilibré et teinté de  futaille .; Spéciale  aigre-douce, post-amertume équilibrée. Agréable à déguster.;Elckerlijc;;
Ename double;Roman;Belgique;13;Abbaye;haute;6,5;33 cl;Oudenaarde;Marron foncé, rougeâtre, limpide, mousse beige subsistant sur 4 mm. Nez malté fin et équilibré, légèrement caramélisé. Saveur mi-douce peu amère, assez profonde, peu épicée, peu âcre, bonne présence du  malt  en bouche arrière bouche douce équilibrée. Légère, coule bien mais manque de relief.;Bière de l' abbaye  St sauveur d'Ename. Bière sur  levure;Ename double;;
Ename triple;Roman;Belgique;15;Abbaye;haute;9;33 cl;Oudenaarde;Jaune-doré, limpide, bien  saturée  en grosses bulles, mousse blanche serrée et abondante. Excellent nez frais, fin et fruité de  houblon , arrière tons de liqueur. Saveur ample, forte, douce, un peu piquante, amertume légère. Houblon et  levure  aromatiques, post-amertume peu marquée. Virile et douce.;Bière de l' abbaye  Saint-Sauveur d'Ename. Alcoolisée et douce.;Ename triple;;
Epi de Facon;Facon;France;12;Pils;basse;5,5;25 cl;St Léonard;Bière blonde, limpide. Goût assez puissant et houblonné sans excés. Bière de type  pils , avec froment, non acide, de qualité moyenne.;Bière spéciale de froment.;Epi de Facon;;
Erdinger Weißbier;Erdinger;Allemagne;12,5;Blanche;haute;5,3;50 cl;Erding;Dépôt de  levure , très saturée, mousse blanche crémeuse, abondante et stable Au nez, présence de céréales moyennement marquée, peu d'acidité. Saveur assez nette et subtile, corps moyen, bouche à peine acide. Bière certes agréable, mais peu rafraîchissant. Correcte, mais sans plus.;Bière  blanche  de type;Erdinger Weißbier;;
Escudo;;Chili;;;;;;;;;Escudo;;
Ex bier;zum Gurten;Suisse;12;Spéciale basse;basse;1;25 cl;Bern;Jaune or, transparente. Mousse très aérée et de faible tenue. Léger parfum de  malt , qui subsiste, ainsi qu'une certaine amertume, surtout en fond de bouche. Agréable, pour une 'sans alcool';Sans alcool;Ex bier;;
Extra Pilsener;Moortgat;Belgique;14;Pils;basse;5;25 cl;Breendonk;Une  pils  assez pâle, jolie mousse, très bien maltée et assez fortement houblonnée. Bonne  pils , corsée.;Pils de chez Moortgat;Extra Pilsener;;
Eylenbosch Gueuze lambic;Eylenbosch;Belgique;14,5;Lambic;spontanée;6;33 cl;Schepdaal;Ambrée. Belle mousse assez fugace. Parfum de cidre. Goût équilibré et subtil, moins sucré que d'autres Gueuzes Bonne  gueuze  dans l'ensemble.;;Eylenbosch Gueuze lambic;;
Eylenbosch Kriek lambic;Eylenbosch;Belgique;14;Lambic;spontanée;5;25 cl;Schepdaal;Belle couleur rouge , mousse bien formée . Bonne kriek .;;Eylenbosch Kriek lambic;;
Fakir;La binchoise;Belgique;14,5;Spéciale;haute;6,8;33 cl;Binche;Spéciale  dorée, limpide (sur  levure ), peu saturée, mousse blanche abondante fine et stable. Nez profond, doux et bien malté, aromatique et relevé, tons de  levure  /  houblon . Saveur parfumée de coriandre, bouche douce, fruitée et ronde. Amertume, corps et acreté moyens. Ampleur, fruité, rondeur.;Harmonie de fruité, rondeur et ampleur, malgré le manque de relief épicé.;Fakir;;
Falsbourg;Union de brasseries;France;10;Pils;basse;4,8;25 cl;Paris;Une  pils  limpide, bien   saturée  en gaz, belle mousse retombant assez vite. Parfum ordinaire, goût bien malté,  pils  très moyenne, typiquement française. Sans commentaire.;;Falsbourg;;
Faro extra;Eylenbosch;Belgique;14;Lambic;spontanée;4,5;75 cl;Schepdaal;Faro cuivré, limpide, peu saturé à la mousse beige claire fugace . Très bon nez subtilement doux et boisé, aigrelet. Goût suret sans excès, typique du faro (bière coupée), mi-doux sans excès, légèrement malté et acide (fond de bouche). Bonne présence, bon corps malgré sa (relative) légèreté.;Véritable  faro . (mélange de  lambic  et de petite bière, puis édulcoré);Faro extra;;
Feldschlösschen Dunkle Perle;Feldschlösschen;Suisse;13,5;Spéciale basse;basse;5,5;25 cl;Rheinfelden;Acajou, assez foncée. Mousse assez aérée et de tenue faible. Subtil parfum de  malt  caramélisé, amertume délicate, bonne pour servir à l'apéritif. Fraîcheur d'une  pils  et moelleux du  caramel  en font un breuvage agréable.;;Feldschlösschen Dunkle Perle;;
Feldschlösschen lager bier;Feldschlösschen;Suisse;13;Pils;basse;4,8;29 et 58 cl;Rheinfelden;Jaune pâle, assez belle mousse de tenue faible. Assez amère, elle a un certain cachet de  malt , mais reste moyenne. Rafraîchissante.;;Feldschlösschen lager bier;;
Felix Kriek;Clarysse;Belgique;11;Spéciale;haute;6;37.5 cl;Oudenaarde;Une brune parfumée à la cerise, arrière goût de  caramel , peu de corps. Goût de cerise bien trop présent, bière tout à fait moyenne. Manque de profondeur.;Bière brune à la cerise ( kriekenbier );Felix Kriek;;
Felix oud bruin;Clarysse;Belgique;12;Spéciale;haute;4,8;25 cl;Oudenaarde;Rouge-ambrée, cristalline, bien  saturée  en bulles moyennes, mousse serrée de faible tenue. Arôme vineux bien malté, nez piquant aux nuances fumées. Saveur aigre-douce, acide et  astringente , évoluant vers un moelleux plus marqué et caramélisé. Arrière goût durable, acide et caramélisé. Moyenne;;Felix oud bruin;;
Fischer Kriek;Fisher/Pêcheur;France;7;Pils;basse;6,5;25 cl;Schilitigeim;Une imitation de KRIEK bien pâle en regard des véritables kriek lambic et  kriekenbier  belges. Sucrée, goût de cerise bizarre. Aucune âme, bière très moyenne. Mélange probable de  pils  et de sirop de cerises.;Bière blonde parfumée à la cerise.;Fischer Kriek;;
Flandrien;Louwaege;Belgique;12,5;Spéciale;haute;5;25 cl;Kortemarke;Une blonde très légèrement ambrée, mousse d'abondance moyenne et d'assez courte durée. Assez bon parfum de  houblon  et de  malt , bière correcte, très léger arrière goût d'alcool, amertume moyenne.;Bière blonde de fermentation haute.;Flandrien;;
