Nom;Brasserie;Pays;Note;Type;Fermentation;°Alc;Bouteille;Ville;Appréciation;Observations;Nom;;
Hostan 11% Svetlý Výcepni Lezák;Znojmo;République Tchéque;14;Pils;basse;2,8;50 cl;Znojmo;Pils limpide, finement saturée, mousse serrée de tenue moyenne. Arôme très équilibré, nez rond de  malt , complexité aromatique des houblons. Goût fin et délicat. Corps net, sans lourdeur, amertume fraîche bien balancée. Post amertume plus amère, sans excès. Belle longueur, bel équilibre malt/ houblon; Pils  tchéque très équilibrée, légère mais corsée, amère mais sans excès.;Hostan 11% Svetlý Výcepni Lezák;;
Hostan 12% Svetlý Lezák;Znojmo;République Tchéque;12,5;Pils;basse;3,1;50 cl;Znojmo;Pils dorée, limpide, bien saturée, à la mousse moyennement serrée et stable Arôme classique de pils, bien caractérisé  malt / houblon , nez légèrement fumé Saveur équilibrée, amertume nette, post-amertume équilibrée, peu fruitée. Bouche corsée assez dense finale longue et affirmée. Bonne Pils Tchéque.; Pils  tchèque typique, corsée, amère, mais toutefois rafraîchissante.;Hostan 12% Svetlý Lezák;;
Houten kop;Strubbe;Belgique;14;Spéciale;haute;6,5;25 cl;Ichtegem;Couleur bronze-boisé, limpide (sur lie), bien saturée, bulles fines, mousse serrée et stable formant un chapeau. Arôme de  malt  boisé, un peu aigre, fin et inhabituel. Saveur corsée, ayant de la mâche, bien maltée avec un petit côté vineux, amertume et post-amertume équilibrées. Bonne bière.;Bière sur  levure .;Houten kop;;
Ice Beer;Engel ;Allemagne;12;Spéciale;Basse;4,5;33 cl;Schwäbisch Gmüd;Brassée selon un procédé spécial, sa température est abaissé au-dessus de 0°C .Couleur  pale, peu d'amertume, bière rafraichissante. ;;;;
Ichtegem's oud bruin;Strubbe;Belgique;11,5;Spéciale;haute;5;25 cl;Ichtegem;Oud bruin  de couleur marron-acajou, limpide (sur  levure ), finement saturée, belle mousse serrée. Au nez, arômes fruités typiques, odeur de vieux bois et de moisissures nobles, nez piquant. Saveur aigre-douce, arrière bouche amère, sucrée, étonnante. Manque de finesse et d'équilibre aigre/doux.;Bière de type Oud bruin;Ichtegem's oud bruin;;
Imperial russian stout;Courage;Angleterre;14;Stout;haute;10;17 cl;Staines;Stout noir, mousse brune assez serrée et stable. Au nez, on perçoit un net arôme de  malt  torréfié et de  caramel  brûlé. Le goût est à la hauteur de l'arôme ; ample, intense. Amertume de café brûlé, saveur de réglisse, goût sucré, dense et très amer. Post-amertume longue, intense. Bouche collante.; Stout  d'une intensité douce-amère incroyable. Bouteille de 17 cl.;Imperial russian stout;;
Jack-op;Brabrux;Belgique;13;Spéciale;haute;5;25 cl;Wolvertem;Orangée, transparente, mousse serrée de durée réduite, bien  saturée . Arôme d'intensité moyenne, malté, houblonné-sur, léger nez caramélisé. Saveur bien maltée, bonne attaque aigre-douce qui s'atténue assez vite (manque de corps), arrière-goût malté-sur,léger et prolongé. Agréable.;;Jack-op;;
Jacobins Framboise;Brouwerj Bockor;Belgique;14;Lambic;Spontanée;5,5;25 cl;Bellegem;;;;;
Jade;Castellain;France;14;Garde;haute;;75 cl;Bénifontaine;Cette garde blonde, jaune paille, limpide posséde une belle mousse de volume assez important, aérée, légère et de durée moyenne. Arôme puissant et légèrement pilsé. Goût bien houblonné et  malt  très présent. Assez bonne bière de  garde .;Bière de  garde  blonde.;Jade;;
Jenlain;Duyck;France;14,5;Garde;haute;6,5;25 ou 75 cl;Jenlain;Une bière ambrée très réputée et connue dans toute la France. Bière cuivrée, à mousse de tenue assez courte. Arôme caramélisé, goût puissant, nuances boisées. Bonne bière de  garde  assez  capiteuse . La  Jenlain  est la Garde française la plus connue (exportée aux USA, GB ...);Fabriquée près de Valenciennes dans le Nord;Jenlain;;
Jenlain de Noël;Duyck;France;14;Garde;haute;6,8;25 cl;Jenlain;Une ambrée de qualité, douce et légèrement caramélisée Produite avec des malt légèrement plus touraillés que pour la  Jenlain  classique. Aromatisée au  houblon  de bourgogne. Voir la  Jenlain  pour le taste-bière.;Bière de Noël;Jenlain de Noël;;
John Bull bitter;Ind coope Ltd.;Angleterre;11,5;Pale Ale;haute;5;33 cl;Londres;Rousse et limpide, finement  saturée . Mousse serrée s'aérant, de tenue correcte. Senteur fine et houblonnée, nez assez sec. Bouche sèche au houblonnage aromatique. Saveur équilibrée, légères nuances de  levure . Arrière goût de durée moyenne. Agréable mais manque évident de caractère.;;John Bull bitter;;
Judas;Alken-Maes;Belgique;15;Spéciale;haute;8,5;33 cl;Waarloos;Une blonde forte, au bon goût fruité de  levure  capiteuse  et aromatique. Bonne bière. Légère saveur d'alcool.;Bière refermentée en bouteille;Judas;;
Julius;De Kluis;Belgique;14,5;Spéciale;haute;8,7;33 cl;Hoegaarden;Couleur abricot, trouble (sur  levure ), mousse blanche serrée, abondante et stable. Nez étonamment frais, arômes de levures très présents, odeur douce et aromatique, très ample. Saveur puissante, bouche pleine et douce, acreté et rondeur affirmées, arrière goût durable. Puissante, aromatique et acre.;;Julius;;
Jupiler;Jupiler;Belgique;12,5;Pils;basse;5,2;25 cl;Jupille;Aspect classique de  pils , mousse serrée de tenue moyenne, jolie couleur jaune pâle. Arôme léger et doux de  malt , goût assez sec, coule bien en bouche. Agréable à boire pour une bière de grande consommation.;;Jupiler;;
K 8;Original Brauereiabfüllung;Belgique;13;Spéciale;Haute;8;33cl;Ingelmunster;Biére à la cannelle.;;;;
Kaltenberg;Kaltenberg;Allemagne;13;Pils;basse;4,8;50 cl;Kaltenberg;Pils jaune, limpide, correctement saturée. Arôme doux, concentré de malt Saveur équilibrée, amertume bien balancée, sans excès. Bouche normalement corsée, post-amertume légère. Bonne pils allemande assez sèche, typique de la production de ce pays. Agréable mais sans personnalité excessive.;;Kaltenberg;;
Kaly Pils;Diekirch;Belgique;12;Pils;Basse;4,8;25 cl;Diekirch;;;Kali Pils;;
Kanterbräu;Kanterbraü;France;9;Pils;basse;4,5;25 ou 33 cl;Boulogne (92);Il faut vraiment avoir très soif ! A part cela, elle désaltère, c'est tout Typiquement française, un peu trop  saturée  en gaz, légèrement piquante. Pils vraiment quelconque.;La bière de maître Kanter.;Kanterbräu;;
Kastaar;De block;Belgique;9;Spéciale;haute;5;25 cl;Peizegem;Une  spéciale  belge, ambrée, arôme puissant de  malt  caramélisé, bière peu  saturée , assez plate, goût puissant de  caramel , mais sans finesse. (Celle que j'ai goûtée n'était peut être plus bonne ?);Bière ambrée;Kastaar;;
Kasteel bier;Van Honsebrouck;Belgique;11;Spéciale;haute;11;33 cl;Ingelmunster;Acajou, foncée, limpide (sur  levure ), mousse beige crémeuse et vivante, peu saturée. Nez puissant, réglissé et liquoreux, légèrement épicé. Saveur très sucrée et amère, dense et ample, liquoreuse. Robe accrocheuse (alcool). Forte et  capiteuse , mais trop sucrée. Manque d'équilibre et de vrai relief.;Bière forte refermentée en bouteille. 'La bière du Château';Kasteel bier;;
Kerelsbier;Leroy;Belgique;13;Spéciale;haute;6,4;25 cl;Boezinge;Bière blonde.;;Stout Leroy;;
Killian's;Pelforth;France;13;Pale Ale;haute;6,5;25 cl;Paris;Ambrée, goût assez malté, nuances pilsées et caramélisées, rattrapées par une légère saveur d'alcool. Coule bien en bouche, mais reste assez éloignée du type  Pale Ale  dont elle se réclame.;Une rousse française selon une recette irlandaise;Killian's;;
Kingston;Fischer;France;13;Spéciale;basse;7,9;25 cl;Schiltigeim;Bière dorée, cristalline, à la mousse blanche et serrée, finement saturée. Arôme doux et fruité de  houblon  et rhum (avec des tons de banane mûre). Saveur douce, intense, sucrée, au goût de banane flambée (au rhum...). Amertume nette et équilibrée. Goût dominant d'alcool. Surprenante !;Bière au rhum des îles. Surprenante, dépaysante, mais on s'en lasse vite.;Kingston;;
Kirin beer;Kirin;Japon;11;Pils;basse;5;33 cl;Japon;Dorée, limpide, grosses bulles, mousse serrée assez tenace. Nez doux, bien malté et légèrement houblonné. Saveur maltée manquant de finesse, assez peu amère et étrangement douce. A peine rafraîchissante à cause de sa douceur et de son maltage. Correcte sa douceur et de son maltage. Correcte sans plus.; pils  japonaise d'une des plus grosses brasseries au monde.;Kirin beer;;
Kochersbier;Haag, Metzger et Cie;France;7;Pils;basse;5,4;25 cl;Hochfelden;Une  pils  alsacienne vraiment quelconque...;;Kochersbier;;
König Ludwig Dunkel;Kaltenberg;Allemagne;12;Münchner;basse;5,1;50 cl;Kaltenberg;Bière marron foncée, limpide, finement saturée, mousse beige aérée et peu tenace. Odeur douce de  caramel , nez relativement peu marqué. Saveur de  houblon  marquée, amertume franche mais peu aromatique, saveur assez sèche et manquant d'amplitude et de plénitude. Goût café-caramel léger. Moyenne.;;König Ludwig Dunkel;;
Korma 5;de ST Amand;France;14,5;Spéciale;haute;5;33 cl;St Amand Tallende;Orange-cuivré, limpide (sur  levure ), peu saturée, mousse fine et serrée de faible tenue. Arôme fruité, odeur légère de gaz carbonique, nuances aigrelettes. Saveur puissante, bouche de  malt  assez profonde et épaisse, amertume équilibrée, post-amertume forte mais assez courte.;Bière de fermentation haute française (auvergne);Korma 5;;
Korma Cassis;de St Amand;France;13;Spéciale;haute;5;33 cl;St Amand Tallende;Marron-roseâtre, limpide (sur  levure ), belle mousse claire, crémeuse et assez tenace. Saturation fine. Nez très fruité de cassis (sirop ?) et de  malt  profond. Saveur inhabituelle mélant fruité et amertume forte. Post amertume couvrant le cassis. Agréable, trop amère pour ce type de fruité.;;Korma Cassis;;
Kortrijk 800;Bockor;Belgique;13;Spéciale;haute;6,9;33 cl;Courtrai;Spéciale mordorée, limpide (sur  levure ) et peu  saturée . Mousse blanche de tenue correcte. Arôme intense, nez concentré (liqueur de banane, rhum ?) Saveur ronde et ample de  malt , bouche douce au goût de  caramel . Amertume équilibrée. Corps ferme et souple, sans prolongement excessif. Chaleureuse.;;Kortrijk 800;;
Kriek Foudroyante;Lindemans;Belgique;11;Lambic;spontanée;4;37.5 cl;Vlezenbeek;Kriek  rouge foncée, peu saturée, légère lie, mousse rosée aérée peu stable. Nez sucré de sirop de cerises, aux allures de sucre chimique. Saveur assez sucrée, légère acidité non boisée. Aucune authenticité, saveur réellement 'grand public', décevante, mal équilibrée. Malheureusement, elle plaira.;Brassée en belgique pour 'Les artisans de la bière' (France). Dommage !;Kriek Foudroyante;;
Krieken bier;St Jozef;Belgique;9;Spéciale basse;basse;5;25 cl;Bree-Opitter;Bière rosée, cristalline, correctement  saturée , à la mousse aérée et de durée moyenne. Arôme légèrement pilsé, nez doux de sirop de cerises. Saveur sucrée, goût artificiel de cerises, amertume d'une  pils  font de cette bière un bien décevant breuvage.Mérite t'elle le qualificatif de  kriekbier  ?;Sorte de  pils  aromatisée aux cerises, rappelle les Krony de Kronenbourg.;Krieken bier;;
Kronen gold export;Kronen;Allemagne;13;Pils;basse;5,2;50 cl;Allemagne;Pils  assez amère. Belle mousse de tenue moyenne, assez compacte. Limpide, elle possède un cachet correct, pas extraodinaire;Brassée selon la rheinheitsgebot allemande;Kronen gold export;;
Kronenbourg;Kronenbourg;France;9;Pils;basse;4,7;33 et 25 cl;Strasbourg;Pils  française très moyenne. A peine rafraîchissante.;;1664 Kronenbourg;;
Kronenbourg light;Kronenbourg;France;8;Pils;basse;2,9;33 et 25 cl;Strasbourg;Pils Pourtant, il existe des bières légères de bonne qualité (ex;  blanche  de Namur). Celle ci n'en fait pas partie.;;Kronenbourg light;;
Kronenpils;Kronenbourg;France;12,5;Pils;basse;4,7;100 cl;Strasbourg;Pils limpide, moyennemant saturée. Mousse blanche fine de faible tenue. Arôme classique de pils, sans surprise. Saveur agréable et bien houblonnée. Amertume forte, post-amertume assez longue. Bière digestive et légère. Excellent accompagnement de repas.;;Kronenpils;;
Kwak;Bosteels;Belgique;15;Spéciale;haute;8;33 cl;Buggenhout;Couleur rubis, claire. Limpide et peu  saturée , son goût est légèrement acerbe, bon équilibre général malgré tout, amertume plutôt faible. Bière forte et capiteuse , appréciable.;Se boit dans un verre de cocher.;Kwak;;
La Bavaisienne;Theillier;France;15;Garde;haute;7,5;25 cl;Bavay;Garde ambrée, limpide, filtrée, à la mousse beige claire serrée et formant un chapeau stable sur le verre. Nez riche de malt légèrement fumé et de houblon, arômes assez intenses. Saveur assez sèche, rondeur du malt, bouche peu sucrée, au fruité équilibré et à l'amertume présente mais sans excès.;Véritable bière de garde du Nord. Goût proche de certaines Ales anglaises.;La Bavaisienne;;
La belle Siska;De Clerck;France;12,5;Spéciale;haute;7;75 cl;Peronne;Bière orangée-rouge, limpide, finement saturée. Mousse beige assez serrée. Odeur agréable mais fine de  houblon  et de  caramel . Saveur douce aux allures nette de caramel, goût doux un peu sucré. Bouche ronde et assez moelleuse (cf. étiquette). Corps moyen s'atténuant rapidement. Bière de bon aloi.;Bière honnête fabriquée à la brasserie De Clerck de Peronne.;La belle Siska;;
La cave des Pères;Engel;Allemagne;13;Spéciale;haute;6,9;50 cl;Schwäbish Gmüd;;Bouteille en grès.;;;
La Cervoise des Ancêtres;Engel;Allemagne;11;Spéciale;haute;6,9;50 cl;Schwäbish Gmüd;;Bouteille en grès.;;;
La Chouffe;Achouffe;Belgique;15;Garde;Basse;8;75 cl;Achouffe;;;La Chouffe;;
La Choulette;La choulette;France;15;Garde;haute;6,9;75 cl;Hordain;Une  garde  ambrée, moelleuse, caramélisée mais sans douceur excessive Mousse fine et serrée, tenue correcte. Bonne bière de  garde . Moins sucrée que la  Jenlain , plus amère. Refermentée en bouteille.;La choulette est un jeu de crosse traditionnel du Nord;La Choulette;;
La Choulette Framboise;La choulette;France;15;Spéciale;haute;6;33 cl;Hordain;Très bonne kriek framboise.;;La Choulette;;
La Cuivrée;Schutzenberger;France;14;Spéciale basse;basse;8;25 cl;Schiltigeim;Bière cuivrée, limpide, à la mousse blanche assez serrée de durée moyenne. Nez délicat de  malt  finement caramélisé, houblonnage typique des bières d'alsace. Saveur corsée mi-douce, tons de  caramel , goût bien houblonné, à la post-amertume durable. De la mâche, du corps, du caractère.;Bière de fermentation basse, forte, bien maltée et corsée.;La Cuivrée;;
La Divine;de silly;Belgique;13,5;Spéciale;haute;9,5;33 cl;Silly;Bière cuivrée-foncé, troublée par sa  levure , mousse claire, abondante et crémeuse. Nez riche et complexe de levures et  houblon , fleuri, fruité et subtilement vineux, doux et profond. Goût surprenant, aigre quoique sucré, amer à la post-amertume assez longue. Etonnant mélange amer-aigre-sucré.;Surprenant mélange aigre, amer et sucré-caramélisé.;La divine;;
La Facon;Facon;France;9;Pils;basse;4,6;25 cl;St Léonard;Une bière de table, commune;Bière du pays Boulonnais;Bière de Noël Semeuse 'La Facon';;
La Fanette;De Clerck;France;15;Spéciale;haute;5;75 cl;Peronne;Bière dorée, transparente. Mousse blanche serrée. Saturation faible. Nez aérien de  levure , parfums doux et léger de  houblon . Arômes fruités nets Bière désaltérante, au corps équilibré, à légère dominance de  malt , saveur assez intense de houblon aromatique doux, fruité. Bonne bière légère typée.;Bière typée malgré sa légèreté. Goût équilibré et fruité-doux. (Banane ?);La Fanette;;
La Guignolette;de Montceau St Waast;France;11,5;Spéciale;haute;6,7;75 cl;Montceau St Waast;Bière brune-rouge, limpide, mousse rosée assez serrée. Nez fruité aux arômes puissants et sucrés de cerise et framboise. Saveur sucrée, bouche épaisse et douce, au goût puissant de sirops de fruits, malheureusement assez mal équilibrée malgré sa légère acidité de framboise. Dommage.;Brassée dans le département du Nord de la France (59).;La Guignolette;;
La Guillotine;Huyghe;Belgique;14;Spéciale;Haute;9,3;33 cl;Gand;Bière blonde;;Guillotine;;
La Pucelle;de Montceau St Waast;France;14;Spéciale;haute;6,6;75 cl;Montceau St Waast;Spéciale  dorée-orangée, transparente, mousse stable serrée, bien saturée. Arôme de pêche marqué, nez doux et très fruité. Heureux mariage acidulé et fruité, légère acreté en fond de bouche. Amertume moyenne, post-amertume courte. Corps assez peu prolongé ; fruité plus long en bouche. Agréable.;Véritable bière du  Nord .;La Pucelle;;
La Trappe blonde;Abbaye trappiste;Hollande;16,5;Trappiste;haute;8;33 cl;Koninghoeven;Trappiste  mordorée, sur  levure , finement saturée, mousse claire, crémeuse. Nez très riche, arômes complexes de levure douce et de houblons aromatiques Nez malté et profond. Saveur moelleuse, acre, goût ample, amertume herbacée Goût fruité de grain, de houblon  frais et de  levure  douce et acre.;Saveur douce. Complexe aromatique acre et herbacé. Goût fruité (banane ?);La Trappe blonde;;
La Trappe brune;Abbaye trappiste;Hollande;16;Trappiste;haute;6,5;33 cl;Koningshoeven;Une  trappiste  (Koningshoeven) brune qui ne manque pas de charmes. Belle mousse, couleur ambrée très foncée, pleine de corps, légèrement épicée et réglissée. Acreté des levures, bonne  saturation . Très bonne  trappiste  brune.;Bière  trappiste  (cisterciens réformés). La seule  trappiste  hollandaise.;La Trappe brune;;
La Vieille Bon Secours;Caulier;Belgique;12;Abbaye;Haute;7,5;33 cl;Peruwelz;;;;;
La vieille Bon-Secours;;Belgique;14,5;Abbaye;haute;7,5;75 cl;Bon-Secours;Abricot-orangée, bien  saturée , limpide. Mousse peu serrée subsistant sur 3 mm. Arôme fruité de  levure , nez liquoreux, puissant et doux, intense et très profond. Peu épicée, mais picotante, amertume équilibrée, saveur douce et âcre persistante. Bien en bouche mais un peu trop sucrée.  Capiteuse .;Bière d' abbaye  belge sur lie;La vieille Bon-Secours;;
La Villeneuvoise;D'annoeullin;France;13,5;Garde;haute;6,4;25 cl;Annoeullin;Une  garde  dorée, limpide,  saturation  moyenne, belle mousse serrée de tenue moyenne. Arôme fin et très fruité, profondeur de  malt  doublée de  houblon . Bière assez corsée, amertume emplissant la bouche sans être excessive, légère âpreté. Bière mi - sèche , agréable et bien faite (voir Pastor Ale);Brassée pour 'Boissons cash Dubus' (Villeneuve d'ascq) par la SBA.;La Villeneuvoise;;
Labatt's Classic;Labatt;Canada;11,5;Pils;basse;5;33 cl;Labatt;Pils  pur malt, cristalline et dorée, peu saturée. Mousse blanche fine et peu tenace. Nez à dominante maltée, assez classique. Goût net, houblonnage léger et équilibré, assez amer. Au goût, dominance du  malt  et corps moyen. Bière correcte, sans distinction particulière, assez moyenne.;Bière canadienne, bien faite mais sans caractère particulier.;Labatt's Classic;;
Lapin Kulta;;Finlande;;;;;;;;;Lapin Kulta;;
L'avesnoise;de Montceau St Waast;France;16;Spéciale;haute;5;25 cl;Montceau St Waast;Blonde dorée, sur  levure , bien saturée, à la mousse serré et stable. Excellent nez fin, boisé et aigrelet. Saveur étonnante pour une bière de ce type. Goût aigrelet caractéristique, allié à une certaine rondeur maltée. Bouche acidulée (citron). Bonne bière surprenante et fraîche.;A boire bien fraîche. Surprenante et désaltérante.;L'avesnoise;;
Le pavé de l'ours;La binchoise;Belgique;14;Spéciale;haute;8,5;75 cl;Binche;Bière jaune-orangée, trouble, bien saturée en bulles fines, mousse claire fine et tenace. Arôme parfumé et fruité de  levure  et de miel de fleurs. Nez doux, aromatique. Saveur douce, un peu acre, non amère, très parfumée, subtile point aigre/fruitée. Bouche fluide, alcoolisée, assez sirupeuse.;Authentique bière au miel. Bonne bière apéritive ou de dessert,  capiteuse .;Le pavé de l'ours;;
L'écume des jours;Brunehaut;Belgique;12;Spéciale;Double;;33 cl;Brunehaut;Bière sur lie.;;;;
Leffe blonde;St guibert;Belgique;13;Abbaye;haute;6,2;25 cl;Dinant;Blonde dorée, cristalline, mousse abondante et serrée. Nez doux d'alcool, assez puissant mais manquant de finesse. Saveur douce légèrement piquante, bien maltée. Rondeur caractéristique. Bonne tenue en bouche, amertume et post-amertume moyennes. Agréable, mais manque de caractère pour une  abbaye .;Monastère de la circarie de Brabant des chanoines réguliers de Prémontré.;Leffe blonde;;
Leffe Brune;St guibert;Belgique;13,5;Abbaye;haute;6,6;33 et 25 cl;Mont st guibert;Acajou foncée, mais limpide. Mousse abondante, assez serrée, durée moyenne. Parfum de  caramel  léger mais assez quelconque, manquant de rondeur et de richesse. Goût caramel grillé assez sec, bouche torréfiée un peu piquante. Post-amertume équilibrée et torréfié mais manque de caractère pour une  abbaye .;Monastère de la Circarie de Brabant des chanoines réguliers de Prémontré;Leffe Brune;;
Leffe Radieuse;St guibert;Belgique;15,5;Abbaye;haute;8,2;33 cl;Dinant;Couleur brique, cristalline, peu  saturée , mousse beige abondante, serrée et de belle tenue. Arôme caramélisé et très subtilement acidulé et épicé. Saveur puissante, caramélisée, assez douce, légèrement piquante et poivrée Bouche moelleuse, alcoolisée. Bonne post-amertume caramélisée.;Bière de l' abbaye  de  Leffe  (chanoines réguliers de Prémontré). Depuis 1960.;Leffe Radieuse;;
Leffe Triple;St guibert;Belgique;16;Abbaye;haute;8;33 cl;Dinant;Blonde mordorée, limpide (sur lie), belle mousse blanche serrée, abondante. Saturation moyenne-faible. Arôme malté-houblonné amer, parfum acre des levures. Saveur fruitée à peine douce, amertume aromatique, bouche pleine, équilibrée et savoureuse. Harmonie de rondeur et d'amertume parfumée.;Bière d' abbaye sur lie, refermentée en bouteille.;Leffe Triple;;
Leffe Vieille cuvée;St guibert;Belgique;13,5;Abbaye;haute;6,2;25 cl;Dinant;Bière marron-orangée, léger trouble, belle mousse onctueuse, mais qui s'aére ensuite, de tenue correcte toutefois. Arôme caramélisé avec des nuances liquoreuses. Goût assez moelleux, surtout en 1ère bouche, bon corps, bière assez sucrée, tons liquoreux. abbaye  correcte mais sucrée.;Monastère de la Circarie de Brabant des chanoines réguliers de Prémontré;Leffe Vieille cuvée;;
Liefmans;Liefmans;Belgique;15;Spéciale;haute;5;25 cl;Oudenaarde;Une excellente brune, légèrement aigre-douce, fine et rafraîchissante. Belle mousse de courte durée, parfum boisé et aigre. Cette bière ' Liefmans ' est la version 'jeune' de la Liefmans Goudenband, qui, elle, est encore bien meilleure. (car mûrie plus longtemps);Oud bruin bier.;Liefmans;;
Liefmans Frambozenbier;Liefmans;Belgique;16;Spéciale;haute;5,1;25 cl et 37.5 cl;Oudenaarde;Rouge très foncé, limpide, mousse brune très fine et abondante, assez peu stable et s'aérant. Nez doux et très fruité de framboises naturelles Bouche fruitée onctueuse et surette. Plénitude en bouche, corps équilibré et onctuosité font de la  Liefmans  frambozenbier une bière de classe !;Mélange de Goudenband (1 an d'âge) et d'un coulis de framboises.;Liefmans Frambozenbier;;
Liefmans Goudenband;Liefmans;Belgique;17,5;Spéciale;haute;5;37.5 cl;Oudenaarde;Brun-acajou profond, limpide (sur lie), mousse beige peu serrée qui s'aére mais tient assez bien. Nez affirmé, vineux, très fin, nuances réglissées. Saveur d'abord piquante, virant à l'acidité douce et boisée. Grande finesse de corps, bon équilibre général, légère post-amertume. Un vrai grand cru !;La célèbre  Liefmans  Goudenband, finesse boisée et aigre douce remarquable.;Liefmans Goudenband;;
Liefmans Kriekbier;Liefmans;Belgique;16;Spéciale;haute;7,1;25 cl;Oudenaarde;Bière brune à la cerise au  goût évolutif , mousse fugace et légère Une excellente bière brune, au goût de cerise prononcé, (nuances de Porto) mais qui s'estompe peu à peu pour laisser réapparaître le goût de la bière brune, bonne tenue en bouche, arrière goût agréable et suret.;Mélange de Goudenband (1 an d'âge) macérée avec des cerises pendant 7 mois.;Liefmans Kriekbier;;
Liefmans Odnar;Liefmans;Belgique;14,5;Spéciale;haute;5,5;33 cl;Oudenaarde;Acajou-foncé, limpide, peu  saturée  en grosses bulles, belle mousse brune abondante, très serrée, de durée moyenne. Arôme  caramel , torréfié et aigre Nez franc, structuré. Bouche d'abord aigre puis caramélisée-grillée. Légère post-amertume. Arrière goût aigre durable. Agréable, mais manque de finesse;Bière aigre de la brasserie  Liefmans .;Liefmans Odnar;;
Lilliput;d' Achouffe;Belgique;14,5;Spéciale;haute;9,5;37.5 cl;Achouffe;Blonde d'un doré profond, limpide, mousse claire assez serrée, saturation fine. Nez très agréable et fruité de pomme mûre, odeur très parfumée. Saveur douce, corps moyen, fruité et sucré, coule bien en bouche. Goût de  levure  fruitée aromatique, peu âcre  Surprenante, douce, forte et fruitée.;Bière sur lie ( levure  très fine et très légère).;Lilliput;;
Lindemans Cassis lambic;Lindemans;Belgique;14,5;Lambic;spontanée;5;37.5 cl;Vlezenbeek;Un  lambic  cassis filtré et pasteurisé, assez sur, désaltérant. Peut être légèrement trop sucrée. La brasserie Lindemans, malheureusement, coupe ses bières avec d'autres de fermentation haute. Un peu d'authentique qui s'en va. Bon  lambic  quand même; lambic  de fermentation spontanée, pasteurisé, filtré.;Lindemans Cassis lambic;;
